Title,Author,Journal
Average Expense per Visit for Adults for Practices Identified as Usual Source of Care Providers during 2016, by Practice Characteristics - Results from the MEPS Medical Organizations Survey.,Stagnitti MN, Wolford ML.,Invest Educ Enferm
Genetics, DNA Damage and Repair.,Al Aboud NM, Basit H, Al-Jindan FA.,Invest Educ Enferm
Anatomy, Back, Vertebral Canal Blood Supply.,Gofur EM, Singh P.,WMJ
Bleeding Disorders.,Doherty TM, Kelley A.,Luminescence
Neuroanatomy, Cerebral Aqueduct (Sylvian).,Rubino JM, Hogg JP.,ANZ J Surg
Forensic Odontology.,Mohammed F, Fairozekhan AT, Menezes RG.,Infant Ment Health J
Physiology, Ligand Gated Chloride Channel.,Clar DT, Maani CV.,Environ Toxicol Chem
Lung Cancer Screening (PDQ<U+00AE>): Patient Version.,PDQ Screening and Prevention Editorial Board.,Dtsch Med Wochenschr
Prostate Cancer Prevention (PDQ<U+00AE>): Patient Version.,PDQ Screening and Prevention Editorial Board.,Integr Biol (Camb)
Oropharyngeal Cancer Treatment (Adult) (PDQ<U+00AE>): Health Professional Version.,PDQ Adult Treatment Editorial Board.,Nicotine Tob Res
Factors Associated with Not Drinking Alcoholic Beverages in Dependent Individuals on Recovery.,Rodr¨ªguez Puente LA, Villa Rivas F, Hern¨¢ndez Mart¨ªnez EK, Castillo Vargas RA, G¨®mez Melasio DA, Navarro Oliva EIP.,Invest Educ Enferm
Challenges of Cooperation between the Pre-hospital and In-hospital Emergency services in the handover of victims of road traffic accidents: A Qualitative Study.,Jamshidi H, Jazani RK, Alibabaei A, Alamdari S, Kalyani MN.,Invest Educ Enferm
Childhood Lead Poisoning in Wisconsin.,Christensen K, Coons MJ, Walsh RO, Meiman JG, Neary E.,WMJ
Bioluminescence properties of Thelepus japonicus (Annelida: Terebelliformia).,Kin I, Jimi N, Oba Y.,Luminescence
Health economic implications of postoperative complications following liver resection surgery: a systematic review.,Cosic L, Ma R, Churilov L, Nikfarjam M, Christophi C, Weinberg L.,ANZ J Surg
Maternal and infant characteristics connected to shared pleasure in dyadic interaction.,Puura K, Lepp<U+00E4>nen J, Salmelin R, M<U+00E4>ntymaa M, Luoma I, Latva R, Peltola M, Lehtim<U+00E4>ki T, Tamminen T.,Infant Ment Health J
Comparative analysis of plant demographic traits across species of different conservation concern: Implications for pesticide risk assessment.,Rueda-Cediel P, Brain R, Galic N, Forbes V.,Environ Toxicol Chem
[Acute Abdominal Pain: Hospital Admission or Not - And What Happens Then?],Garbe J, Michl P, Klement A.,Dtsch Med Wochenschr
Raman spectroscopy reveals LPS-induced changes of biomolecular composition in monocytic THP-1 cells in a label-free manner.,T<U+00F6>pfer N, M¨¹ller MM, Dahms M, Ramoji A, Popp J, Slevogt H, Neugebauer U.,Integr Biol (Camb)
Impacts of smoking ban policies on restaurants in Seoul, South Korea: Analysis of objective sales information.,Noh JW, Choi M, Kwon YD, Yoo KB.,Nicotine Tob Res
